{
  "chapter_id": "ch001",
  "passage_id": "p01",
  "title_cn": "乱世里的刘备",
  "goal": "introduce Liu Bei's situation and emotional direction",
  "dramatic_question": "Can someone with so little still choose a bigger path?",
  "viewpoint_focus": ["liu_bei"],
  "emotion_curve": ["pressure", "restraint", "resolve"],
  "hook": "Liu Bei had almost nothing, but he could not stop thinking about the world outside him.",
  "conflict": "He is poor and small, while the chaos around him is large.",
  "turn": "He decides that surviving is not enough.",
  "ending_hook": "That choice will soon lead him to two men he does not yet know.",
  "scene_ids": ["s1", "s2", "s3"],
  "status": "draft"
}
